{
  "manager_id": "mgr_1",
  "season_id": "2025-26",
  "chip": "wildcard_fh",
  "status": "available",
  "used_gameweek": null,
  "observed_at": "2026-07-21T12:00:00Z",
  "available_at": "2026-07-21T12:00:00Z",
  "provenance": {
    "source_ids": [
      "fpl-official-endpoints"
    ],
    "transformation_version": "0.1.0",
    "ruleset_id": "2026-27-v0.1"
  }
}
